{
  "schemaVersion": 1,
  "kind": "ImageIndexObserved",
  "recordedAt": "2026-08-25T06:21:47Z",
  "source": {
    "type": "github-actions",
    "workflow": "mirror / quarantine/python",
    "runUrl": "https://github.com/toddysm/cssc-framework/actions/runs/32816568923",
    "runId": "32816568923",
    "runAttempt": "1"
  },
  "occurrence": {
    "registry": "ghcr.io",
    "repository": "toddysm/quarantine/python"
  },
  "index": {
    "digest": "sha256:8a14a31f4bf634c04722154f30eb33998b4068de8b83b6b2800ec1b7238555d0",
    "tag": "3.14-slim"
  },
  "platforms": [
    {
      "digest": "sha256:5b945726c4d7ffe6595dc7498ad17fd0397e373c5181c24819a7028e8b1276dc",
      "os": "linux",
      "architecture": "amd64"
    },
    {
      "digest": "sha256:4ec9b0965c06e78ca43cdbfecd1565fa3008621d3653f5a4a01b8858abb1188d",
      "os": "linux",
      "architecture": "arm",
      "variant": "v5"
    },
    {
      "digest": "sha256:935cfb353b2dfe02ebafd79674d305a7325e6e2e6d6b889a14b3bbe9526f7c9a",
      "os": "linux",
      "architecture": "arm",
      "variant": "v7"
    },
    {
      "digest": "sha256:de1d3e88b8ab340de928906e98846611ea7cece9ed335fdeba5309bfcd89117b",
      "os": "linux",
      "architecture": "arm64",
      "variant": "v8"
    },
    {
      "digest": "sha256:145ee7a57727c5ec47a1ef5e9e78b774c3873f845f2f5d61d0658e0f38234b40",
      "os": "linux",
      "architecture": "386"
    },
    {
      "digest": "sha256:aabe8e7b962e9a1ddb4f963eb55fcbe6130f8e33535ea56c259af2957f724a02",
      "os": "linux",
      "architecture": "ppc64le"
    },
    {
      "digest": "sha256:e598e43242a96ae026892715bd2b3f71fa5f57404ca44177897bd1e66d6535c8",
      "os": "linux",
      "architecture": "riscv64"
    },
    {
      "digest": "sha256:988c4caa8b2069735b7b992674dbcd801f720e3800b5d7a81cc68c4e640e4912",
      "os": "linux",
      "architecture": "s390x"
    }
  ],
  "observedAt": "2026-08-25T06:21:47Z",
  "id": "sha256:4255b5ab08de9f8a44f7fd495932bff7ad33a6ab8cf511a01fd5007c8d0c26c4"
}
